{
  "$schema": "https://json-schema.org/draft/2020-12/schema",
  "title": "factual_blocks.v1",
  "description": "Structured factual blocks response for LM Studio Lab offline validation.",
  "type": "object",
  "additionalProperties": false,
  "required": [
    "schema_version",
    "status",
    "blocks",
    "warnings"
  ],
  "properties": {
    "schema_version": {
      "type": "string"
    },
    "status": {
      "type": "string"
    },
    "blocks": {
      "type": "array",
      "items": {
        "type": "object",
        "additionalProperties": false,
        "required": [
          "block_id",
          "normalized_text",
          "status",
          "warnings"
        ],
        "properties": {
          "block_id": {
            "type": "integer"
          },
          "normalized_text": {
            "type": "string"
          },
          "status": {
            "type": "string"
          },
          "warnings": {
            "type": "array",
            "items": {
              "type": "string"
            }
          }
        }
      }
    },
    "warnings": {
      "type": "array",
      "items": {
        "type": "string"
      }
    }
  }
}
