{
  "schema_version": "factual_blocks.v1",
  "status": "success",
  "blocks": [
    {
      "block_id": 101,
      "normalized_text": "Synthetic first fact.",
      "status": "success",
      "warnings": []
    },
    {
      "block_id": 999,
      "normalized_text": "Synthetic unexpected fact.",
      "status": "success",
      "warnings": []
    }
  ],
  "warnings": []
}
